{
  "$schema": "https://json-schema.org/draft/2020-12/schema",
  "title": "pontia agent tools contract v1",
  "type": "object",
  "additionalProperties": false,
  "properties": {
    "$schema": {
      "type": "string",
      "description": "Local schema reference for this tool contract file."
    },
    "version": {
      "const": 1
    },
    "namespace": {
      "type": "string",
      "minLength": 1
    },
    "description": {
      "type": "string",
      "minLength": 1
    },
    "tools": {
      "type": "array",
      "minItems": 1,
      "items": {
        "type": "object",
        "additionalProperties": false,
        "properties": {
          "name": {
            "type": "string",
            "pattern": "^[a-z][A-Za-z0-9_]*$"
          },
          "title": {
            "type": "string",
            "minLength": 1
          },
          "description": {
            "type": "string",
            "minLength": 1
          },
          "inputSchema": {
            "$ref": "https://json-schema.org/draft/2020-12/schema"
          },
          "outputSchema": {
            "$ref": "https://json-schema.org/draft/2020-12/schema"
          }
        },
        "required": ["name", "title", "description", "inputSchema", "outputSchema"]
      }
    }
  },
  "required": ["$schema", "version", "namespace", "description", "tools"]
}
